{
  "schema_version": "1.0.0",
  "task_id": "task-2026-02-12-002",
  "status": "completed_no_changes",
  "summary": "Reviewed implementation and confirmed behavior already matches request.",
  "findings": [],
  "commands_run": [
    "rg \"ValidateRequest\" -n internal/",
    "go test ./internal/api"
  ],
  "tests": {
    "passed": 24,
    "failed": 0,
    "skipped": 0
  },
  "next_steps": []
}
