{
  "schema_version": "1.0.0",
  "task_id": "task-2026-02-12-003",
  "status": "blocked",
  "summary": "Could not complete DB integration due to missing runtime configuration.",
  "blockers": [
    {
      "type": "missing_config",
      "details": "DATABASE_URL is not set in the environment."
    }
  ],
  "requested_input": [
    "Provide a valid DATABASE_URL for local test execution."
  ],
  "partial_progress": [
    "Prepared migration file",
    "Updated repository interface"
  ],
  "commands_run": [
    "go test ./..."
  ],
  "tests": {
    "passed": 0,
    "failed": 1,
    "skipped": 0
  }
}
